{
  "version": "1.0",
  "meta": {
    "title": "HTML 动态 PPT · 12 种页型",
    "subtitle": "一次渲完 12 页 · 36 秒 · 全部可机器校验",
    "issuer": "AiMarketing 视频工厂",
    "date": "2026-10",
    "lang": "zh-CN"
  },
  "style": {
    "masterId": "master-v2",
    "palette": "indigo",
    "density": "normal",
    "tempo": "normal",
    "orientation": "16:9"
  },
  "pages": [
    {
      "type": "cover",
      "kicker": "ALL 12 TYPES · 2026-10",
      "asset": "assets/cover.jpg"
    },
    {
      "type": "section",
      "number": "01",
      "title": "页型收口",
      "subtitle": "从 4 种长到 12 种，每一种都有像素级证据"
    },
    {
      "type": "bullets",
      "title": "为什么值得换",
      "items": [
        "真圆角真图表真模糊都能画",
        "同一输入同一输出可复现",
        "与现有成片线直接拼接",
        "改版式不改成片链路"
      ],
      "summary": "换的是渲染层，旁白字幕与拼接都不动"
    },
    {
      "type": "steps",
      "title": "接一条新片的本机流程",
      "index": "number",
      "steps": [
        "先写 deck.json 并过契约校验",
        "生成 HTML 并对账逐字段",
        "逐帧渲染成 H.264 片",
        "抽帧看版式再做像素反推",
        "与现有成片拼接后配音上字幕"
      ]
    },
    {
      "type": "chart",
      "title": "单帧耗时对照（实测）",
      "chart": {
        "type": "bar",
        "series": [
          62.5,
          70.5,
          92.3,
          29,
          24.9
        ],
        "labels": [
          "720p",
          "720p截图",
          "1080p",
          "母版12s",
          "六页18s"
        ]
      },
      "unit": "ms / 帧",
      "explain": "同一台机器上不同捕获模式与组合复杂度的单帧耗时",
      "source": "本机 i7-12700F · chrome-headless-shell 152"
    },
    {
      "type": "compare",
      "title": "换线前后的取舍",
      "left": {
        "label": "现状 · 滤镜手画",
        "points": [
          "版式高度稳定可控",
          "真圆角模糊画不出",
          "改一版要素要改代码"
        ]
      },
      "right": {
        "label": "HTML 逐帧",
        "points": [
          "真圆角图表模糊都有",
          "同输入同输出可复现",
          "改版式不动成片链路",
          "需要无头 Chrome 环境"
        ]
      },
      "conclusion": "版式能力换实现复杂度，成片链路基本不动"
    },
    {
      "type": "image",
      "title": "素材驱动的片子是主场景",
      "asset": "assets/test-media.png",
      "layout": "full",
      "kicker": "MEDIA · PIXEL VERIFIED",
      "caption": "四象限测试图：用于像素级验证素材确实上屏"
    },
    {
      "type": "data",
      "title": "确定性实测",
      "metric": {
        "number": 0,
        "unit": "帧差异",
        "explain": "同一份 HTML 两次渲染，逐帧比对差异为 0"
      },
      "secondary": [
        {
          "label": "MD5 完全相同",
          "note": "字节级一致，非仅像素一致"
        },
        {
          "label": "PSNR 全为 inf",
          "note": "200 帧逐帧 mse = 0.00"
        }
      ]
    },
    {
      "type": "quote",
      "quote": "同一输入产出同一字节，是回归测试能被信任的前提。",
      "author": "本机探针结论",
      "context": "2026-10-02 · 200 帧逐帧比对"
    },
    {
      "type": "toc",
      "title": "十二种页型全览",
      "items": [
        "封面与尾页定框架",
        "章节页切分段落",
        "要点页承载论述",
        "图表与数据讲数字",
        "步骤与对比讲取舍",
        "图片与引用给情绪"
      ]
    },
    {
      "type": "summary",
      "title": "收口小结",
      "items": [
        "页型从四种长到十二种",
        "每一种都有可复跑的像素证据",
        "契约、校验器、基线三处同步"
      ],
      "closing": "下一步：把这条链接进生产入口"
    },
    {
      "type": "end",
      "line1": "十二种页型已经全部跑通",
      "line2": "对账零未命中，契约可回归",
      "cta": "下一步：接进生产入口",
      "en": "TWELVE PAGE TYPES · MACHINE-CHECKED"
    }
  ]
}
