{
  "version": "1.0",
  "meta": {
    "title": "反例：自定义封面素材尚未实现",
    "subtitle": "用于退出码回归：必须明确报错，不许静默忽略",
    "lang": "zh-CN"
  },
  "style": {
    "masterId": "master-v1",
    "palette": "warm-gold",
    "density": "normal",
    "tempo": "normal",
    "orientation": "16:9"
  },
  "pages": [
    { "type": "cover", "asset": "assets/my-own-cover.jpg" },
    {
      "type": "bullets",
      "title": "占位要点页",
      "items": ["第一条占位要点内容", "第二条占位要点内容", "第三条占位要点内容"],
      "summary": "这页只为满足最少 3 条要点与页数下限"
    },
    {
      "type": "end",
      "line1": "反例结束占位",
      "cta": "这页只是为了满足末页建议",
      "en": "PLACEHOLDER FOR REGRESSION ONLY"
    },
    {
      "type": "end",
      "line1": "反例结束占位二",
      "cta": "这页只是为了满足末页建议",
      "en": "PLACEHOLDER FOR REGRESSION ONLY TWO"
    }
  ]
}
