{
  "version": "1.0",
  "meta": {
    "title": "图片页三种版式",
    "subtitle": "竖屏只有 full（left/right 已在契约层禁用 · D15）",
    "lang": "zh-CN"
  },
  "style": {
    "masterId": "master-v1",
    "palette": "warm-gold",
    "density": "normal",
    "tempo": "normal",
    "orientation": "9:16"
  },
  "pages": [
    {
      "type": "cover",
      "kicker": "IMAGE LAYOUTS"
    },
    {
      "type": "image",
      "title": "竖屏满幅：有角标、无图注",
      "asset": "assets/test-media.png",
      "layout": "full",
      "kicker": "FULL"
    },
    {
      "type": "image",
      "title": "竖屏满幅：有图注",
      "asset": "assets/test-media.png",
      "layout": "full",
      "caption": "竖屏下媒体是整宽顶带，文案落在下方版心"
    },
    {
      "type": "image",
      "title": "满幅压字版式",
      "asset": "assets/test-media.png",
      "layout": "full",
      "caption": "文字压在图上，靠渐隐底衬保证对比度"
    },
    {
      "type": "end",
      "line1": "三种图片版式都已上屏",
      "line2": "素材像素与全幅对比度都有证据",
      "cta": "下一步：接入真实素材池",
      "en": "LEFT · RIGHT · FULL"
    }
  ]
}
